id;publication_type;authors;year;title;editors;journal_book_conf;volume;issue;pages;publisher;doi;isbn;citations;notes;peer_reviewed;exclude;study_samples;study_type;study_setting;smarthome;technology;scale_origin;scale_number;scale_number_new;reliability_alpha_studypaper;reliability_alpha_studypaper_new;reliability_composite_studypaper;reliability_other_studypaper;validity_information_studypaper;as_outcome_variable;cause_variables;cause_variables_new;cause_variables_theory;cause_variables_theory_other;cause_variables_theory_certainty;as_cause_variable;outcome_variables;outcome_variables_new;outcome_variables_theory;intervention;intervention_description;intervention_description_new;sample_size;sample_size_new;sample_age;sample_age_new;sample_sex;sample_sex_male;sample_sex_female;sample_sex_nonbinary;sample_sex_noresponse;sample_profession;sample_profession_new;sample_recruitment;sample_country
381;0;Lin;2016;Educating Students’ Privacy Decision Making through Information Ethics Curriculum;NA;Creative Education;7;1;171–179;NA;10.4236/ce.2016.71017;NA;3 (google scholar, 12.4.21);NA;1;1;NA;1;1;0;not_specified;1;35;135;NA;NA;NA;NA;NA;1;information ethics course;training;mastery, vicarious experience, persuasion;NA;0;1;privacy intention;privacy intention;intention;0;NA;NA;111;111;range: 18-25;21,5000000000000;"58% male; 42% female";58,00;42,00;NA;NA;students;students;2;Taiwan
384;0;Liu et al.;2020;Motivating information security policy compliance: The critical role of supervisor-subordinate guanxi and organizational commitment;NA;International Journal of Information Management;54;NA;102152;NA;10.1016/j.ijinfomgt.2020.102152;NA;8 (google scholar, 26.4.21);NA;1;1;NA;2;1;0;"computer; workplace_IT";1;36;12I;NA;NA;NA;NA;NA;0;NA;NA;NA;NA;NA;1;compliance behavior;compliance behavior;behavior;0;NA;NA;235;235;20-39: 52.7%;29,5000000000000;70.6% male;70,60;29,40;NA;NA;government employees/students;government employees;2;China
400;0;Ma et al.;2015;A survey-based study of factors that motivate nurses to protect the privacy of electronic medical records;NA;BMC Medical Informatics and Decision Making;16;1;13-23;NA;10.1186/s12911-016-0254-y;NA;28 (google scholar, 12.4.21);NA;1;1;NA;2;1;0;"not_specified; workplace_IT";1;37;136;NA;NA;NA;NA;NA;0;NA;NA;NA;NA;NA;1;perceived behavioral control;behavioral control;control;0;NA;NA;302;302;"18-29: 19.2%; 30-49: 74.8%; 50-64: 6%";33,6380000000000;"2% male; 98% female";2,00;98,00;NA;NA;nurses;healthcare professionals;2;Taiwan
405;0;Mamonov et al.;2016;The impact of exposure to news about electronic government surveillance on concerns about government intrusion, privacy self-efficacy, and privacy protective behavior;NA;Journal of Information Privacy and Security;12;2;1–12;NA;10.1080/15536548.2016.1163026;NA;7 (google scholar, 26.4.21);NA;1;1;NA;0;0;0;"not_specified; online_news";1;IB:39 vs NB:26;39;NA;NA;NA;NA;NA;1;"repeated exposure to government surveillance news (mental resources); age; gender; education; privacy concern";"mental resources; age; gender; education; concerns";"other; other; other; other; other";"cognitive; demographics; demographics; demographics; cognitive";0;0;NA;NA;NA;1;"differentiation of control group and treatment group; 
The control group was then exposed to four general government-related news stories. 
The treatment group was exposed to four news stories related specifically to government surveillance programs.";exposure to news: four government surveillance news vs. four general government-related news;442;442;34.9 (SD=12.9);34,9000000000000;60.2% male;60,20;39,80;NA;NA;NA;NA;0;USA
408;5;Manzano;2012;The cybercitizen dimension: A quantitative study using a threat avoidance perspective;NA;Doctor of Philosophy;NA;NA;NA;ProQuest LLC;NA;978-1-267-44129-4;3 (google scholar, 12.4.21);experimental group;2;1;A;2;1;0;computer;1;38;137;NA;NA;NA;NA;NA;0;NA;NA;NA;NA;NA;1;avoidance motivation;avoidance motivation;motivation;0;NA;NA;49;49;"21-25: 6.1%; 26-30: 10.2%; 31-35: 18.4%; 36-40: 10.2%; 41-45: 2%; 46-50: 18.4%; 51-55: 14.3%; 56-60: 18.4%; 61-65: 2%";43,4100000000000;"male 41%; female 59%";41,00;59,00;NA;NA;employees of beverage distribution company;employees of beverage distribution company;2;USA
412;0;Masrek et al.;2017;Modelling smartphone security behaviour of university students;NA;Turkish Online Journal of Educational Technology;NA;November Special Issue;537–545;NA;NA;NA;0 (google scholar, 26.4.21);NA;1;1;NA;2;1;0;smartphone;1;39;138;NA;NA;NA;NA;NA;0;NA;NA;NA;NA;NA;1;smartphone security behavior;security behavior;behavior;0;NA;NA;346;346;"<20: 16.5%; 21-23: 50%; 24-26: 25.7%; >27: 7.8%";23,9530000000000;"male 26.3%; female 73.7%";26,30;73,70;NA;NA;students;students;2;Malaysia
418;2;McGill et al.;2021;Piloting the Air Force JROTC Cyber Academy for High School Students;NA;Proceedings of the 52nd ACM Technical Symposium on Computer Science Education (SICGSE '21);NA;NA;597–603;Virtual Event;10.1145/3408877.3432471;NA;0 (google scholar, 14.7.21);participants and sample size diverge due to datasharing consent;0;1;NA;1;0;0;"not_specified; computer";0;33;84;"0.89 to 0.94 for pre-test; 0.91 to 0.97 for post-test";0.928;NA;NA;NA;1;gender;gender;other;demographics;0;0;NA;NA;NA;1;"8 week cyber academy teaching cybersecurity skills and career awareness (3-5 hours online course daily);  pre- and post measure of self-efficacy
modules targeted to develop content knowledge in computational thinking, computer programming, and cybersecurity knowledge, skills, and abilities; Increase awareness of cybersecurity and CS educational and vocational pathways; Increase interest in taking CS and cybersecurity courses at school; 
course modules: introduction to cybersecurity & cybercrime; cryptography & industry awareness; networking & server attacks; wireless network security; authentication, account and access management; vulnerability assessment and ehtical hacking; secure system design; database principles;  additional discussions with 16 speakers from industry and government; 
weekly workshop tasks/competitive activities: simulation of the installation of malicious software & incident reporting (Cadets receive a phishing email, supposedly signed by the instructor, indicating the need to view a webpage for updated exercise information that contains a simulated virus string); simulation of a network denial service attack (An increased amount of network traffic is generated on the network that results in reduced performance for users); developping a product analysis report (Cadets made product selection recommendations in light of known threats and vulnerabilities, using CVEdetails.com, a free security vulnerability website. Each team analyzes vulnerabilities of three products and present their findings and recommendations);  developping an internet of things challenge using tinkercard (As an Arduino team project, cadets create a stoplight/intersection system); developping a security plan for a physical location (Teams develop a plan for the physical security of a student-run data center.)";course to teach cybersecurity skills and career awareness: knowledge, skills, abilities, awareness, interest, simulations, reports, challenges;19;19;NA;NA;"10 male; 9 female";52,63;47,37;NA;NA;high school cadets;students;2;USA
419;0;McGill et al.;2017;Old risks, new challenges: exploring differences in security between home computer and mobile device use;NA;Behaviour and Information Technology;36;11;1-14.;Taylor & Francis;10.1080/0144929x.2017.1352028;NA;42 (google scholar, 14.7.21);sample duplicate of paper ID 607 (uses same (sub-)sample);1;1;NA;2;0;0;"mobile_device; computer";1;34;71A;NA;NA;NA;NA;NA;1;device type (mobile vs. home computer);device type;mastery;NA;1;0;NA;NA;NA;0;NA;NA;629;629;"Home device (322): 2.5% 18-24; 8.2% 25-34; 12.3% 35-44; 19.8% 45-54; 33.0% 55-64; 24.3% >=65
Mobile device (307): 3.0% 18-24; 7.9% 25-34; 15.4% 35-44; 19.7% 45-54; 33.1% 55-64; 21.0% >=65";53,1643934817170;"37.5% male; 62.5% female";37,50;62,50;NA;NA;NA;NA;0;USA
429;5;Mitchell;2020;Cyber security home: The effect of home user perceptions of personal security performance on household IoT security intentions;NA;Doctor of Philosophy in Information Science and Technology;NA;NA;NA;ProQuest LLC;NA;979-8662426054;0 (google scholar, 26.4.21);NA;2;1;NA;2;0;1;"not_specified; smarthome";1;IB:40 vs NB:28;40;NA;NA;NA;NA;NA;0;NA;NA;NA;NA;NA;1;"security intention existing security software usage; security intention existing network protection measures; security intention existing internet of things protection measures; security intention future security changes; security intention future internet of things protection changes";"security intention; security intention; security intention; security intention; security intention";"intention; intention; intention; intention; intention";0;NA;NA;569;569;"18-24: 3.87%; 25-34: 27.07%; 35-44: 38.31%; 45-54: 15.11%; 55-64: 12.13%; 65-74: 3.16%; 75-84: 0.35%";41,1020500000000;"56.59% male; 42% female; 0.7% non-binary; 0.7% NA";56,59;42,00;0,70;0,70;NA;NA;1;USA
430;0;Mohamed et al.;2012;Information privacy concerns, antecedents and privacy measure use in social networking sites: Evidence from Malaysia;NA;Computers in Human Behavior;28;6;2366–2375;NA;10.1016/j.chb.2012.07.008;NA;258 (google scholar, 26.4.21);NA;1;1;NA;2;1;0;"not_specified; social_network";1;40;89A;NA;NA;NA;NA;NA;0;NA;NA;NA;NA;NA;1;information privacy concern;concerns;other;0;NA;NA;340;340;NA;NA;"male 41.2%; female 58.8%";41,20;58,80;NA;NA;students;students;2;Malaysia
433;2;Mousavizadeh et al.;2015;A study of the effect of privacy assurance mechanisms on self-disclosure in social networking sites from the view of protection motivation theory;NA;36. International Conference on Information Systems;NA;NA;NA;Fort Worth, TX, USA;NA;NA;15 (google scholar, 9.6.21);NA;0;1;NA;2;0;0;"not_specified; social_network";1;41;139;NA;NA;NA;NA;NA;1;privacy customization control;control salience;persuasion;NA;0;1;privacy concern;concerns;other;0;NA;NA;241;241;18-25: 80.1%;21,5000000000000;"male 49.8%; female 50.2%";49,80;50,20;NA;NA;students;students;2;USA
438;0;Mwagwabi et al.;2018;Short-term and Long-term Effects of Fear Appeals in Improving Compliance with Password Guidelines;NA;Communications of the Association for Information Systems;42;NA;147–182;NA;10.17705/1CAIS.04207;NA;18 (google scholar, 12.4.21);treatment group;1;1;A;0;0;0;"not_specified; computer";1;42;140;NA;NA;NA;NA;NA;1;password training;training;persuasion;NA;1;1;intention to comply;compliance intention;intention;1;password-security information and training session.;training to improve user password-security behavior: fear appeals as persuasive messages, which also include instructions on how to execute actions to improve self-efficacy vs. no intervention;210;210;"of all 419 participants: M = 43.7; range: 18-65";43,7000000000000;of all 419 participants: 57.9% female;42,10;57,90;NA;NA;NA;NA;0;USA
441;2;Humaidi et al.;2014;Exploring user's compliance behavior towards Health Information System security policies based on extended Health Belief Model;NA;2014 IEEE Conference on e-Learning, e-Management and e-Services (IC3e);NA;NA;NA;Melbourne, Australia;10.1109/IC3e.2014.7081237;NA;6 (google scholar, 26.4.21);"sample duplicate of paper ID 270, but different research model; possible same scale (#17 in package 1, NB)";1;1;NA;2;1;0;"not_specified; health_information_system";1;59;141;NA;NA;NA;NA;NA;0;NA;NA;NA;NA;NA;1;user's compliance behavior towards health information system's security policies;compliance behavior;behavior;0;NA;NA;454;454;"20-40: 86.7%; >40: 13.2%";32,6100000000000;"male 21.4%; female 78.6%";21,40;78,60;NA;NA;health professionals;healthcare professionals;2;Malaysia
442;2;Mat et al.;2019;Developing a New Model for Cyber Security Behavior of E-Hailing Services: A Conceptual Paper;NA;2019 International Conference on Computer and Drone Applications (IConDA);NA;NA;33-37;Kuching, Malaysia;10.1109/IConDA47345.2019.9034919;NA;0 (google scholar, 8.6.21);NA;1;1;NA;2;NA;0;not_specified;1;IB:41 vs NB:;41;NA;NA;NA;NA;NA;0;NA;NA;NA;NA;NA;1;"perceived threat; perceived threat of new entry; perceived threat of substitute; cyber security behavior";"perceived threat; perceived threat; perceived threat; security behavior";"other; other; other; behavior";0;NA;NA;139;139;NA;NA;NA;NA;NA;NA;NA;"students; university staff";"students; university staff";2;Malaysia
452;2;Nguyen et al.;2017;Enforcing Information Security Protection: Risk Propensity and Self-Efficacy Perspectives;NA;50th Hawaii International Conference on System Sciences;NA;NA;4947-4956;Puako, HI, USA;10.24251/hicss.2017.601;NA;6 (google scholar, 12.4.21);NA;1;1;NA;2;NA;0;"not_specified; computer";1;43;142;NA;NA;NA;NA;NA;1;"self-technical controllability; general technology awareness";"self-technical controllability; awareness";"other; other";"cognitive; cognitive";0;1;"information security protection effort; information security risk perception; information security reinforcement intention";"effort; perceived risk; reinforcement intention";"behavior; other; intention";0;NA;NA;244;244;NA;NA;NA;NA;NA;NA;NA;students;students;2;USA
465;1;Ophoff et al.;2019;Mitigating the Ransomware Threat: A Protection Motivation Theory Approach;Venter et al.;Communications in Computer and Information Science - Information Security;NA;NA;163-175;Springer, Switzerland;10.1007/978-3-030-11407-7_12;NA;3 (google scholar, 14.7.21);unsure whether referenced source/author is correct;1;1;NA;2;0;0;"not_specified; computer";1;35;85B;NA;NA;NA;NA;NA;0;NA;NA;NA;NA;NA;1;protection motivation;protection motivation;motivation;0;NA;NA;118;118;"0% <18; 59% 18-24; 23% 25-34; 11% 35-44; 5% 45-54; 2% 55-64; 0% >65";27,1850000000000;"47% male; 52% female; 1% prefer not to answer";47,00;52,00;NA;1,00;university students and staff;"students; university staff";2;South Africa
479;0;Pendegraft et al.;2010;Factors Influencing College Students’ Use of Computer Security;NA;International Journal of Information Security and Privacy;4;3;51–60;NA;10.4018/jisp.2010070104;NA;6 (google scholar, 14.7.21);NA;1;1;NA;2;0;0;computer;1;36;86;NA;NA;NA;NA;NA;1;"experience with security; security easy of use; peer influence; training to use security";"experience; ease of use; peer influence; training";"mastery; emotional arousal; persuasion; vicarious experience";NA;1;1;"security outcome expectancy; security attitudes";"outcome expectation; attitude";"other; other";0;NA;NA;101;101;"M = 21.88 (SD = 4.79); range: 18-52";21,8800000000000;"53% male; 47% female";53,00;47,00;NA;NA;students;students;2;USA
482;0;Pham et al.;2019;Information security burnout: Identification of sources and mitigating factors from security demands and resources;NA;Journal of Information Security and Applications;46;NA;96-107;Elsevier;10.1016/j.jisa.2019.03.012;NA;16  (google scholar, 14.7.21);NA;1;1;NA;2;NA;0;"workplace_IT; computer";1;37;87;NA;NA;NA;NA;NA;0;NA;NA;NA;NA;NA;1;security compliance burnout;compliance behavior;behavior;0;NA;NA;443;443;most participants: 18-34;26,0000000000000;NA;NA;NA;NA;NA;employees who use networked computer application or accessed networked internet as part of their job on a daily basis;employees;1;Vietnam
486;5;Poleon;2020;Millennials’ information security habits and protection motivation intention: A quantitative study;NA;Doctor of Philosophy;NA;NA;NA;ProQuest LLC;NA;979-8662568563;0 (google scholar, 14.7.21);NA;2;1;NA;2;0;0;computer;1;38;88;NA;NA;NA;NA;NA;1;habit;habit;mastery;NA;0;1;intention to install antivirus software;protection intention;intention;0;NA;NA;257;257;born between 1980 and 2000;30,0000000000000;NA;NA;NA;NA;NA;NA;NA;3;USA
497;2;Crossler;2010;Protection Motivation Theory: Understanding Determinants to Backing Up Personal Data;NA;43rd Hawaii International Conference on System Sciences;NA;NA;1–10;Koloa, HI, USA;10.1109/HICSS.2010.311;NA;128 (google scholar, 12.4.21);NA;1;1;NA;2;3;0;computer;1;44;143;NA;NA;NA;NA;NA;0;NA;NA;NA;NA;NA;1;backup data;security behavior;behavior;0;NA;NA;112;112;"M = 31.12; range 20-76";31,1200000000000;female 61.3%;38,70;61,30;NA;NA;NA;NA;3;USA
498;0;Raddatz et al.;2020;Internal Motivators for the Protection of Organizational Data;NA;Journal of Information Systems;34;3;199-211;NA;10.2308/isys-18-067;NA;0 (google scholar, 9.6.21);NA;0;1;NA;2;0;0;"not_specified; computer; workplace_IT";1;45;144;NA;NA;NA;NA;NA;0;NA;NA;NA;NA;NA;1;"perceived control; intention to protect organizational data";"perceived control; protection intention";"control; intention";0;NA;NA;283;283;31.8 <= M <= 34.6;33,2000000000000;male 57.9%;57,90;42,10;NA;NA;employees;employees;0;NA
501;0;Ranzini et al.;2020;Sharenting, Peer Influence, and Privacy Concerns: A Study on the Instagram-Sharing Behaviors of Parents in the UK;NA;Social Media + Society;6;4;1-13;Sage;10.1177/2056305120978376;NA;0 (google scholar, 14.7.21);NA;1;1;NA;2;0;0;"not_specified; instagram";0;39;89B;0.79;0.79;0.79;NA;"construct factor validity: EFA was employed to establish unidimensionality and internal consistency of the constructs; 
discrimant validity: Fornell-Larcker: situational privacy concerns; peer influence; general privacy concerns";0;NA;NA;NA;NA;NA;1;"Instagram sharing; sharenting";"sharing; sharenting";"behavior; behavior";0;NA;NA;320;320;"M = 34.65 (SD = 6.60); 6.2% 18-25; 41.6% 26-33; 36.2% 34-41; 13.8% 42-49; 2.2% >=50";34,6500000000000;"16.3% male; 83.7% female";16,30;83,70;NA;NA;NA;NA;0;UK
517;0;Flores et al.;2016;Shaping intention to resist social engineering through transformational leadership, information security culture and awareness;NA;Computers & Security;59;NA;26–44;NA;10.1016/j.cose.2016.01.004;NA;119 (google scholar, 26.4.21);"A: qualitative part (not included); B: quantitative part";1;1;B;2;0;0;"not_specified; computer; workplace_IT";1;46;145;NA;NA;NA;NA;NA;1;"general information security awareness; information security policy awareness";"awareness; awareness";"mastery, persuasion; mastery, persuasion";NA;1;1;intention;behavioral intention;intention;0;NA;NA;1583;1583;"18-24: 1%; 25-34: 16%; 35-44: 29%; 45-54: 31%; >=55: 24%";45,5300000000000;"male 66%; female 34%";66,00;34,00;NA;NA;employees;employees;2;Sweden
523;2;Aurigemma et al.;2015;The Role of Social Status and Controllability on Employee Intent to Follow Organizational Information Security Requirements;NA;48th Hawaii International Conference on System Sciences;NA;NA;3527–3536;Kauai, HI, USA;10.1109/HICSS.2015.424;NA;7 (google scholar, 26.4.21);NA;1;1;NA;2;0;0;"not_specified; workplace_IT";0;IB:42 vs NB:32;42;NA;NA;0.968;NA;NA;0;NA;NA;NA;NA;NA;1;"behavioral intent; behavioral control";"compliance intention; behavioral control";"intention; control";0;NA;NA;182;182;NA;NA;NA;NA;NA;NA;NA;US Department of Defense (DoD) employees;department of defense employees;2;USA
524;2;Verkijika;2020;Employees' Cybersecurity Behaviour in the Mobile Context: The Role of Self-Efficacy and Psychological Ownership;NA;2020 2nd International Multidisciplinary Information Technology and Engineering Conference (IMITEC);6;4;1-13;NA;10.1177/2056305120978376;NA;0 (google scholar, 14.7.21);NA;1;1;NA;2;0;0;mobile_device;1;40;90;NA;NA;NA;NA;NA;0;NA;NA;NA;NA;NA;1;"mobile security intention; mobile security behavior";"security intention; security behavior";"intention; behavior";0;NA;NA;214;214;62.6%: 21-40;30,5000000000000;"53.3% male; 47.7% female";53,30;47,70;NA;NA;employees using mobile devices for work purposes;employees;NA;South Africa
527;0;Sharma;2020;Digital Health Innovation: Exploring Adoption of COVID-19 Digital Contact Tracing Apps;NA;IEEE Transactions on Engineering Management (IEEE Transactions on Engineering Management);NA;NA;1–17;NA;10.1109/TEM.2020.3019033;NA;11 (google scholar, 12.4.21);NA;1;1;NA;2;0;0;"not_specified; smartphone";0;paperID687;104;0.870;0.870;0.872;NA;"content validity: scales used to measure items were validated by prior studies. They were appropriately modified to the context of this study... a pilot test was conducted with ten Ph.D. students at the University of the South Pacific. Based on the results of this test, minor changes were made to the phrasing of the items;
discriminant and convergent validity: AVE, MSV, Max R(H): collectivism; uncertainty avoidance; attitude; subjective norm; perceived effectiveness of privacy policy; perceived effectiveness of industry self-regulation; perceived severity; perceived vulnerability; information privacy concerns; expected personal outcomes of sharing; expected community-related outcomes of sharing; adoption intention";0;NA;NA;NA;NA;NA;1;"privacy concern; adoption intention";"concerns; adoption intention";"other; intention";0;NA;NA;714;714;"18-21: 20.5%; 22-31: 41.5%; 32-41: 25.2%; 42-51: 7.28%; 52-61: 5.04%; 62+ 0.14%; NA: 0.42%";32,1456000000000;"38.8% male; 60.5% female; 0.7% NA";38,80;60,50;NA;0,70;NA;NA;1;Fiji
528;0;Safa et al.;2015;Information security conscious care behaviour formation in organizations;NA;Computers & Security;53;NA;65–78;NA;10.1016/j.cose.2015.05.012;NA;317 (google scholar, 26.4.21);NA;1;1;NA;2;3;0;"not_specified; workplace_IT";1;IB:44 vs NB:34;43;NA;NA;NA;NA;NA;0;NA;NA;NA;NA;NA;1;information security conscious care behavior;security behavior;behavior;0;NA;NA;212;212;"20-29: 21.2%; 30-39: 32.1%; 40-49: 24.5%; >=50: 22.2%";39,3810000000000;"51.4% male; 48.6% female";51,40;48,60;NA;NA;information security + technology experts;IS professionals;NA;Malaysia
531;0;Salleh et al.;2012;An Empirical Investigation on Internet Privacy on Social Network Sites among Malaysian Youths;NA;Journal of Information Technology Research;5;3;85-97;NA;10.4018/jitr.2012070105;NA;4 (google scholar, 8.6.21);NA;1;1;NA;2;1;0;"not_specified; social_network";1;IB:45 vs NB:;44;NA;NA;NA;NA;NA;0;NA;NA;NA;NA;NA;1;information disclosure behavior;disclosure behavior;behavior;0;NA;NA;486;486;"<20: 32.7%; 20-24: 60.7%; 25-30: 3.2%; >30: 0.4%";20,6270000000000;"40.9% male; 59.1% female";40,90;59,10;NA;NA;students;students;2;Malaysia
533;5;Sanga;2016;The effect of electronic devices self-efficacy, electronic devices usage and information security awareness on identity-theft anxiety level;NA;Doctor of Philosophy in Technology;NA;NA;NA;ProQuest LLC;NA;978-1369623147;0 (google scholar, 12.4.21);NA;2;1;NA;2;0;0;"mobile_device; computer";1;IB:46 vs NB:54;45;NA;NA;NA;NA;NA;0;NA;NA;NA;NA;NA;1;identity-theft anxiety;anxiety;other;0;NA;NA;187;187;"<19: 3.7%; 20-29: 58.8%; 30-39: 19.8%; 40-49: 9.6%; 50-59: 6.4%; >60: 1.6%";30,7855000000000;"43.9% male; 56.1% female";43,90;56,10;NA;NA;students;students;2;USA
536;2;Sarathchandra et al.;2016;College Students' Cybersecurity Risk Perceptions, Awareness, and Practices;NA;2016 Cybersecurity Symposium;NA;NA;68–73;Coeur d'Alene, ID, USA;10.1109/CYBERSEC.2016.9;NA;13 (google scholar, 12.4.21);NA;1;1;NA;2;0;0;not_specified;1;IB:47 vs NB:55;46;NA;NA;NA;NA;NA;0;NA;NA;NA;NA;NA;1;perceptions of cybersecurity;security perceptions;other;0;NA;NA;498;498;NA;NA;"41% male; 59% female";41,00;59,00;NA;NA;students;students;2;USA
540;0;Schade et al.;2018;Increasing consumers’ intention to use location-based advertising;NA;Journal of Product & Brand Management;27;6;661–669;NA;10.1108/jpbm-06-2017-1498;NA;3 (google scholar, 12.4.21);NA;1;1;NA;2;0;0;smartphone;1;IB:48 vs NB:56;47B;NA;NA;NA;NA;NA;0;NA;NA;NA;NA;NA;1;privacy concern;concerns;other;0;NA;NA;1132;1132;"14-19: 5.0%; 20-29: 41.8%; 30-39: 32.4%; 40-49: 12.8%; 50-59: 6.6 %; >=60: 1.4%";32,4470000000000;"58.1% male; 41.9% female";58,10;41,90;NA;NA;NA;NA;0;Germany
545;2;Sedek et al.;2018;Motivational Factors in Privacy Protection Behaviour Model for Social Networking;NA;MATEC Web of Conferences;150;NA;NA;Penang, Malaysia;10.1051/matecconf/201815005014;NA;0 (google scholar, 9.6.21);NA;1;1;NA;2;1;0;"not_specified; social_network";1;47;146;NA;NA;NA;NA;NA;0;NA;NA;NA;NA;NA;1;information privacy concern;concerns;other;0;NA;NA;485;485;"21-25: 93%; 26-30:7%";23,3500000000000;"male 52%; female 48%";52,00;48,00;NA;NA;students;students;2;Malaysia
550;0;Shahri et al.;2016;The Impact of the Security Competency on “Self-Efficacy in Information Security” for Effective Health Information Security in Iran;NA;Journal of Medical Systems;40;11;241-249;NA;10.1007/s10916-016-0591-5;NA;13 (google scholar, 12.4.21);NA;1;1;NA;2;NA;0;"not_specified; workplace_IT; health_information_system";1;IB:49 vs NB:57;48;NA;NA;NA;NA;NA;1;security competence;expertise;mastery;NA;1;1;health information system security effectiveness;security effectiveness;other;0;NA;NA;263;263;NA;NA;NA;NA;NA;NA;NA;hospital employees;healthcare professionals;2;Iran
553;0;Shappie et al.;2020;Personality as a Predictor of Cybersecurity Behavior;NA;Psychology of Popular Media;9;4;475–480;NA;10.1037/ppm0000247;NA;12 (google scholar, 14.7.21);NA;1;1;NA;2;0;0;not_specified;1;41;91;NA;NA;NA;NA;NA;0;NA;NA;NA;NA;NA;1;cyber security behavior;security behavior;behavior;0;NA;NA;676;676;"M = 23; range 18-56";23,0000000000000;"21.6% male; 78.1% female";21,60;78,10;NA;NA;students;students;2;USA
557;0;Sher et al.;2017;How can hospitals better protect the privacy of electronic medical records? Perspectives from staff members of health information management departments;NA;Health Information Management Journal;46;2;87-95;Sage;10.1177/1833358316671264;NA;22 (google scholar, 14.7.21);NA;1;1;NA;2;1;0;"not_specified; workplace_IT";1;42;92;NA;NA;NA;NA;NA;0;NA;NA;NA;NA;NA;1;intention to protect electronic medical records privacy;protection intention;intention;0;NA;NA;209;209;"18.2% 20-29; 46.9% 30-39; 27.8% 40-49; 7.1% =>50";36,9155000000000;"13.9% male; 86.1% female";13,90;86,10;NA;NA;staff members in health information management departments of hospitals;IT employees of hospitals;2;Taiwan
