id;publication_type;authors;year;title;editors;journal_book_conf;volume;issue;pages;publisher;doi;isbn;citations;notes;peer_reviewed;exclude;study_samples;study_type;study_setting;smarthome;technology;scale_origin;scale_number;scale_number_new;reliability_alpha_studypaper;reliability_alpha_studypaper_new;reliability_composite_studypaper;reliability_other_studypaper;validity_information_studypaper;as_outcome_variable;cause_variables;cause_variables_new;cause_variables_theory;cause_variables_theory_other;cause_variables_theory_certainty;as_cause_variable;outcome_variables;outcome_variables_new;outcome_variables_theory;intervention;intervention_description;intervention_description_new;sample_size;sample_size_new;sample_age;sample_age_new;sample_sex;sample_sex_male;sample_sex_female;sample_sex_nonbinary;sample_sex_noresponse;sample_profession;sample_profession_new;sample_recruitment;sample_country
1;0;Alturki et al.;2020;Factors Influencing Players’ Susceptibility to Social Engineering in Social Gaming Networks;NA;IEEE Access (IEEE Access);8;NA;97383–97391;NA;10.1109/ACCESS.2020.2995619;NA;3 (google scholar 08.07.21);"possible error for stated scale author for items 2-4; loadings of 3 variables listed but 4 items included in the survey";1;1;NA;2;0;0;social_gaming_network;1;1;54;NA;NA;NA;NA;NA;0;NA;NA;NA;NA;NA;1;social engineering victimization;victimization;other;0;NA;NA;302;302;NA;NA;NA;NA;NA;NA;NA;NA;NA;1;Saudi Arabia
4;2;Farooq et al.;2019;Factors Affecting Security Behavior of Kenyan Students: An Integration of Protection Motivation Theory and Theory of Planned Behavior;NA;2019 IEEE AFRICON;NA;NA;1–8;Accra, Ghana;10.1109/AFRICON46755.2019.9133764;NA;1 (google scholar, 12.4.21);NA;1;1;NA;2;0;0;not_specified;1;IB:1 vs NB:2;1;NA;NA;NA;NA;NA;0;NA;NA;NA;NA;NA;1;behavioral security intention;security intention;intention;0;NA;NA;123;123;"22.34 (SD = 3.99); range 17-35";22,3400000000000;"69% male; 31% female";69,00;31,00;NA;NA;students;students;2;Kenya
8;0;Abdallah et al.;2020;Information security awareness behavior among higher education students: Case study;NA;Journal of Theoretical and Applied Information Technology;98;18;3825–3836;NA;NA;NA;0 (scopus, 12.4.21);NA;1;1;NA;2;NA;0;not_specified;1;1;106;NA;NA;NA;NA;NA;0;NA;NA;NA;NA;NA;1;information security awareness;awareness;other;0;NA;NA;180;180;"< 20: 38.8%; >20: 61.2%";31,6580000000000;"60.5% male; 39.5%female";60,50;39,50;NA;NA;students;students;2;UAE
10;5;Abraham;2012;Exploring the effectiveness of information security training and persuasive messages;NA;Doctor of Philosophy;NA;NA;NA;ProQuest LLC;NA;NA;3 (google scholar, 8.6.21);sample seems to have similarities to ID 11 (due to different sample size not coded as a sample duplicate);2;1;NA;0;0;0;computer;1;IB:2 vs NB:;2;NA;NA;NA;NA;NA;1;"prior malware experience; training method (learner control and feedback)";"experience; learner control and feedback";"mastery; mastery, persuasion";NA;1;1;"danger control; fear control";"danger control; fear control";"control; control";1;"training to identify fake websites; detailed steps that can be taken in order to implement security practices; three kinds of fear appeal messages (basic fear appeal, two-sided fear appeal, graphic fear appeal); two kinds of training (CDT present (Component Display Theory applied (training is learner-driven along two dimensions [content and performance] and provides primary and secondary presentation forms)); CDT non-present); CDT-centered tutorial provided avenues for rules, examples, recall, practice and control which was facilitated by stating objectives (making the training menu-based, with interactive modules, hyperlinks, interactive practice examples
and quizzes.); self-efficacy was measured pre- and post-test";training to identify fake websites:  training with Component Display Theory applied (learner-driven) vs. training without CDT applied;151;151;20-29: 60%;24,5000000000000;"68% male; 30% female; 2% NA";68,00;30,00;NA;1,00;students;students;2;USA
11;0;Abraham et al.;2019;Evaluating the effectiveness of learner controlled information security training;NA;Computers & Security;87;NA;101586;Elsevier;10.1016/j.cose.2019.101586;NA;16 (google scholar 08.07.21);sample seems to have similarities to ID 10 (due to different sample size not coded as a sample duplicate);1;1;NA;0;0;0;"not_specified; computer";1;2;55;NA;NA;NA;NA;NA;1;training method (learner control and feedback);learner control and feedback;mastery, persuasion;NA;1;1;behavioral intent to comply with information security best practices;compliance intention;intention;1;"the online training covered the topics web security best practices such as examining URLs, the importace of https, padlock icon and other common indicators of fake websites such as spelling errors ; manipulation of the training method (2 conditions, with or without instructional control elements); non-leanerer-control condition covered the ame contents but without hyberlinks, questions, answers and examples that were included in the learner-control-condition; the training was followed by a survey that included a security training performance test";training to learn security best practices: training with instructional control element (learner-control) and training without instructional control elements (non-learner-control);197;197;"6% 18-20; 60% 20-29; 8% >30; 26% NA";29,5800000000000;68% male, 30% female, 2% NA;68,00;30,00;NA;2,00;students;students;2;USA
15;0;Adhikari et al.;2018;Users' Information Privacy Concerns and Privacy Protection Behaviors in Social Networks;NA;Journal of Global Marketing;31;2;1–15;NA;10.1080/08911762.2017.1412552;NA;31 (Google Scholar, 30.04.21);NA;1;1;NA;2;1;0;"not_specified; social_network";1;IB:3 vs NB:4;3;NA;NA;NA;NA;NA;0;NA;NA;NA;NA;NA;1;users' information privacy concern;concerns;other;0;NA;NA;306;306;"median 22; range 18-34";22,0000000000000;"58.17% male; 41.83% female";58,17;41,83;NA;NA;students;students;2;India
19;0;Ahmad et al.;2019;Security monitoring and information security assurance behaviour among employees;NA;Information and Computer Security;27;2;165–188;NA;10.1108/ics-10-2017-0073;NA;17 (google scholar, 26.4.21);NA;1;1;NA;2;0;0;computer;1;IB:4 vs NB:1;4;NA;NA;NA;NA;NA;1;information security policy;information security policy;persuasion;NA;0;1;security assurance behavior;assurance behavior;behavior;0;NA;NA;525;525;"<30: 25%; 31-40: 38.5%; 41-50: 23.8%; 51-60: 12.8%";37,6005000000000;"59.2% male; 40.8% female";59,20;40,80;NA;NA;employees from telecommunication companies;employees from telecommunication companies;2;Malaysia
25;0;Alanazi et al.;2020;Theory-Based Model and Prediction Analysis of Information Security Compliance Behavior in the Saudi Healthcare Sector;NA;Symmetry;12;9;1544;MDPI;10.3390/sym12091544;NA;4 (google scholar 08.07.21);NA;1;1;NA;2;0;0;"not_specified; computer; workplace_IT";1;3;56;NA;NA;NA;NA;NA;0;NA;NA;NA;NA;NA;1;information security compliance behavior;compliance behavior;behavior;0;NA;NA;433;433;M = 33.2;33,2000000000000;53.10% male, 46.9% female;53,10;46,90;NA;NA;healthcare personnel;healthcare professionals;2;Saudi Arabia
26;2;Albladi et al.;2017;Competence Measure in Social Networks;NA;2017 International Carnahan Conference on Security Technology (Iccst);NA;NA;NA;Madrid, Spain;NA;NA;5 (google scholar, 26.4.21);NA;0;1;NA;2;NA;0;"not_specified; social_network";1;2;107;NA;NA;NA;NA;NA;0;NA;NA;NA;NA;NA;1;user competence in detecting security threats in online social networks;expertise;other;0;NA;NA;17;17;range: 25-44;34,5000000000000;12 female;29,41;70,59;NA;NA;students;students;2;UK
28;0;Al-diabat;2018;Investigating the Determinants of College Students Information Security Behavior Using a Validated Multiple Regression Models;NA;International Journal of Computer Science and Information Technology;10;6;81–96;NA;10.5121/ijcsit.2018.10608;NA;1 (google scholar, 8.6.21);"Items 2 and 3 identical wording (but we suspect a copy paste error [cf. paper ID 34 items]); item assignment to authors does not match (have all items only from Ng et al. (2009) and not from two authors; [cf. paper ID 34 items])";1;1;NA;2;1;0;computer;1;IB:5 vs NB:;5;NA;NA;NA;NA;NA;0;NA;NA;NA;NA;NA;1;information computer security behavior;security behavior;behavior;0;NA;NA;263;263;"18-22: 61%; 23-30: 23%; 31-40: 9%; >=41: 7%";25,0250000000000;"59% male; 41% female";59,00;41,00;NA;NA;students;students;2;USA
32;5;Almuqrin;2018;Examining the influence of technology acceptance, self-efficacy, and locus of control on information security behavior of social media users;NA;Doctor of Philosophy;NA;NA;NA;ProQuest LLC;NA;NA;NA;no citation found;2;1;NA;2;0;0;"not_specified; social_network";1;3;108;NA;NA;NA;NA;NA;0;NA;NA;NA;NA;NA;1;information security behavior;security behavior;behavior;0;NA;NA;559;559;range: 18-29, M = 23.14;23,1400000000000;"50.8% male; 49.2% 
female";50,80;49,20;NA;NA;students;students;2;Saudi Arabia
34;5;Alqarni;2017;Exploring factors that affect adoption of computer security practices among college students;NA;Doctor of Philosophy in Technology;NA;NA;763;Master's Theses and Doctoral Dissertations;NA;NA;2 (google scholar, 8.6.21);original scale Ng et al. (2009);1;1;NA;2;1;0;computer;0;IB:6 vs NB:Ng et al. (2009);6;0.82;0.82;NA;NA;"content validity: pilot study; N = 10; 
convergent validity: corrected total item correlation (table 18) and 
discriminant validity: inter-correlations (table 18): computer security practices; perceived vulnerability; perceived severity; response efficacy;  perceived usefulness; perceived ease of use; awareness; attitude toward computer security practices; subjective norms; perceived behavioral control";0;NA;NA;NA;NA;NA;1;computer security practices;security behavior;behavior;0;NA;NA;301;301;"18-28: 90%; 29-38: 7.6%; +39: 2.3%";24,3845000000000;NA;NA;NA;NA;NA;students;students;2;USA
36;2;Alshboul et al.;2017;Beyond Cybersecurity Awareness: Antecedents and Satisfaction;NA;2017 International Conference on Software and e-Business (ICSEB);NA;NA;85-91;Hong Kong, Hong Kong;10.1145/3178212.3178218;NA;5 (google scholar, 05.7.21);NA;0;1;NA;2;0;0;"not_specified; workplace_IT";1;4;57;NA;NA;NA;NA;NA;0;NA;NA;NA;NA;NA;1;awareness of information security policies;awareness;other;0;NA;NA;236;236;NA;NA;NA;NA;NA;NA;NA;university employees;university staff;2;USA
42;0;Anwar et al.;2017;Gender difference and employees' cybersecurity behaviors;NA;Computers in Human Behavior;69;NA;437–443;NA;10.1016/j.chb.2016.12.040;NA;133 (google scholar, 12.4.21);NA;1;1;NA;2;0;0;"not_specified; computer";1;IB:7 vs NB:5;7;NA;NA;NA;NA;NA;1;"computer skills; experience with cyber security practice";"expertise; experience";"mastery; mastery";NA;0;1;self-reportes cyber security behavior;security behavior;behavior;0;NA;NA;481;481;"23%: 18-20; 42%: 21-30; 16%: 31-40; 11%: 41-50; 8% >=50";30,1650000000000;"34% male; 66% female";34,00;66,00;NA;NA;employees;employees;1;USA
43;4;Arachchilage;2016;Serious Games for Cyber Security Education;NA;NA;NA;NA;NA;LAP LAMBERT, Academic Publishing;NA;978-3659853180;4 (google scholar, 12.4.21);main study;2;1;A;2;1;0;mobile_device;1;4;109;NA;NA;NA;NA;NA;0;NA;NA;NA;NA;NA;1;avoidance motivation;avoidance motivation;motivation;0;NA;NA;151;151;range: 18-25;21,5000000000000;"67% male; 33% female";67,00;33,00;NA;NA;students;students;2;UK
43;4;Arachchilage;2016;Serious Games for Cyber Security Education;NA;NA;NA;NA;NA;LAP LAMBERT, Academic Publishing;NA;978-3659853180;4 (google scholar, 12.4.21);think-aloud study (game design);2;1;B;1;1;0;mobile_device;1;5;110;NA;NA;NA;NA;NA;0;NA;NA;NA;NA;NA;0;NA;NA;NA;1;The game is designed to randomly generate worms associate with URLs. The small fish (the game player) is presented a worm each time associated with a different URL. The URL can b either phishing or legitimate. When the user moves from the beginning to the end of the game, the complexity of URLs is dramatically increased. This helps the user to gain the conceptual knowledge of identifying URLs. Therefore, self-efficacy of preventing from phishing attacks will be addressed in the game design.;game to identify phishing URLs: fish is presented an URL-worm (either phishing or legitimate) with increasing URL-complexity;20;20;range: 18-25;21,5000000000000;"65% male; 35% female";65,00;35,00;NA;NA;students;students;2;UK
56;5;Aurigemma;2013;From the weakest link to the best defense: Exploring the factors that affect employee intention to comply with information security policies;NA;Doctor of Philosophy in Communication and Information Sciences;NA;NA;NA;ProQuest LLC;NA;978-1-303-31317-2;9 (google scholar, 05.7.21);Not sub-samples, but different scales: General ISP;2;1;A;2;3;0;"not_specified; workplace_IT";1;5A;12C;NA;NA;NA;NA;NA;0;NA;NA;NA;NA;NA;1;"perceived behavioral control (regarding General information security policy); perceived behavioral control (regarding removable flashmedia); perceived behavioral control (regarding tailgaiting threats); intention to comply with information security policy (regarding phishing threat)";"behavioral control; behavioral control; behavioral control; compliance intention";"control; control; control; intention";0;NA;NA;239;239;NA;NA;9% female;91,00;9,00;NA;NA;department of defense employees;department of defense employees;2;USA
61;0;Ayaburi et al.;2019;Antecedents and Outcome of Deficient Self-Regulation in Unknown Wireless Networks Use Context: An Exploratory Study;NA;Information Systems Frontiers;21;6;1213–1229;NA;10.1007/s10796-019-09942-w;NA;3 (google scholar, 12.4.21);NA;1;1;NA;2;0;0;mobile_device;1;6;111;NA;NA;NA;NA;NA;0;NA;NA;NA;NA;NA;1;self-regulation;self-regulation;other;0;NA;NA;476;476;"range: 25-35; <25: 19.7% (94), 25-35: 52.9% (252), 36-45: 15.5% (74), >45: 11.8% (56)";36,1745000000000;"63% male; 37% female";63,00;37,00;NA;NA;NA;NA;0;NA
62;2;Fatokun et al.;2020;Relating Factors of Tertiary Institution Students’ Cybersecurity Behavior;NA;2020 International Conference in Mathematics, Computer Engineering and Computer Science (ICMCECS);NA;NA;1-6.;Aayoba, Nigeria;10.1109/ICMCECS47690.2020.246990;NA;0 (Google Scholar, 14.05.21);NA;1;1;NA;2;0;0;not_specified;1;6;58;NA;NA;NA;NA;NA;0;NA;NA;NA;NA;NA;1;cyber security behavior;security behavior;behavior;0;NA;NA;450;450;"17-20: 36 (8.3%)
21-30: 251 (57.7%)
31-40: 113 (26.0%)
Above 40: 35 (8.0%)";29,4790000000000;male 180 (41.4%), female 255 (58.6%);41,40;58,60;NA;NA;students;students;3;Malaysia
79;0;Belanger et al.;2019;Dealing with digital traces: Understanding protective behaviors on mobile devices;NA;The Journal of Strategic Information Systems;28;1;34–49;NA;10.1016/j.jsis.2018.11.002;NA;27 (google scholar, 12.4.21);other study samples were part of the paper, but not relevant for this review;1;1;E;2;0;0;smartphone;1;IB:8 vs NB:10;8;NA;NA;NA;NA;NA;0;NA;NA;NA;NA;NA;1;mobile information protection intention;protection intention;intention;0;NA;NA;228;228;"18-20: 4.41%; 21-24: 22.03%; 25-34: 44.49%; 35-44: 16.3%; 45-54: 7.49%; 55-64: 2.64%; 65-74: 2.64%";40,2969500000000;"51.33% male; 48.67 female";51,33;48,67;NA;NA;NA;NA;3;USA
81;0;Beldad;2016;Sealing One's Online Wall Off From Outsiders: Determinants of the Use of Facebook's Privacy Settings among Young Dutch Users;NA;International Journal of Technology and Human Interaction;12;1;21–34;NA;10.4018/ijthi.2016010102;NA;9 (google scholar, 26.4.21);NA;1;1;NA;2;1;0;"not_specified; facebook";1;7;112;NA;NA;NA;NA;NA;0;NA;NA;NA;NA;NA;1;use of Facebook's privacy settings;use behavior;behavior;0;NA;NA;295;295;"16-17: 32.9%; 18-19: 40.3%; 20-21: 21.7%; 22-23: 5.1%";18,4800000000000;"43.4% male; 56.3% female";43,40;56,30;NA;NA;students;students;2;Netherlands
82;2;Bell et al.;2015;Developing and Piloting a Quantitative Assessment Tool for Cybersecurity Courses;NA;122nd ASEE Annual Conference and Exposition: Making Value for Society;NA;NA;1-13.;Seattle, WA, USA;NA;NA;8 (Google Scholar, 14.05.21);NA;1;1;NA;3;1;0;not_specified;1;7;59;NA;NA;NA;NA;NA;1;cyber security course;training;mastery, vicarious experience, persuasion;NA;1;0;NA;NA;NA;0;NA;NA;"CS1: pre 93, post 74; Cyber Defense: pre 11, post 9; Advanced: pre 5, post 6; Intro Sec: pre 30, post 21";110;NA;NA;NA;NA;NA;NA;NA;students;students;2;USA
83;2;Bell et al.;2014;A longitudinal study of students in an introductory cybersecurity course;NA;121st ASEE Annual Conference & Exposition;NA;NA;NA;Indianapolis, IN, USA;NA;NA;11 (google scholar, 9.6.21);NA;1;1;NA;3;1;0;not_specified;1;8;113;NA;NA;NA;NA;NA;1;introductory cybersecurity course;training;mastery, vicarious experience, persuasion;NA;1;0;NA;NA;NA;0;NA;NA;12;12;NA;NA;10 male, 2 female;83,33;16,67;NA;NA;students;students;2;USA
86;2;Berthevas;2018;Students' computers safety behaviors, under effects of cognition and socialization: When gender and job experience influence information security behaviors;NA;2018 IEEE International Conference on Technology Management, Operations and Decisions (Ictmod);NA;NA;244–251;Marrakech, Morocco;NA;NA;1 (google scholar, 12.4.21);NA;1;1;NA;2;NA;0;not_specified;1;IB:9 vs NB:12;9;NA;NA;NA;NA;NA;0;NA;NA;NA;NA;NA;1;protection motivation theory (behavioral intention);protection intention;intention;0;NA;NA;430;430;"18-20: 45.6%; 21-25: 47.2%; 26-30: 4.2%; >31: 3%";22,0610000000000;"43.3% male; 56.7% female";43,30;56,70;NA;NA;students;students;2;France
87;5;Beugré;2019;Perceived behaviors and security compliance intention of employees processing big data: A correlational study;NA;Doctor of Philosophy;NA;NA;NA;ProQuest LLC;NA;978-1392680988;0 (google scholar, 05.7.21);Originalskala: Herath et al. (2009);2;1;NA;2;0;0;"not_specified; workplace_IT";0;8;60;NA;NA;NA;NA;NA;0;NA;NA;NA;NA;NA;1;security compliance intention;compliance intention;intention;0;NA;NA;169;169;"27-36: 112 (66%)
37-46: 45 (27%)
47-56: 10 (6%)
57 or older: 2 (1%)";35,6700000000000;male 104 (62%), female 65 (38%);62,00;38,00;NA;NA;IT professionals specialized in big data;IT professionals;0;USA
94;0;Blythe et al.;2018;Costly but effective: Comparing the factors that influence employee anti-malware behaviours;NA;Computers in Human Behavior;87;NA;87-97;Elsevier;10.1016/j.chb.2018.05.023;NA;32 (google scholar, 05.7.21);"Not sub-samples, but different scales: A:  anti-malware software, B: email security, C: software updates; participants could only complete scale 9a/9b/9c if their organisational imformation security policy would allowed them to show the different behaviors (use USB sticks, email, update software, access anti-malware) so that samples for 9a/9b/9c had different sample sizes and varying overlaps in participants; 
total sample (size: 526 participants, age: mean 35.52 (SD=12.22), sex: 38 % male; 61% female; 1% NA)";1;1;A;2;0;0;"not_specified; workplace_IT";1;9A;61A;NA;NA;NA;NA;NA;1;experience;experience;mastery, emotional arousal;NA;1;1;"intention to perform anti-malware behavior (using anti-malware software to scan USB sticks for malware); intention to perform anti-malware behavior (not clicking on links in suspicious emails); intention to perform anti-malware behavior (installing software updates when prompted)";"protection intention; security intention; protection intention";"intention; intention; intention";0;NA;NA;324;324;NA;NA;NA;NA;NA;NA;NA;employees;employees;1;UK
95;0;Bojmaeh;2015;Mediating role of Information System Security Awareness in the relationship between Self-Efficacy, Security Practice and Information System Security Behavior;NA;International Journal of Science and Engineering Applications;4;6;361–365;NA;NA;NA;1 (google scholar, 8.6.21);original scale Karamizadeh et al. (2013);1;1;NA;2;NA;0;not_specified;0;IB:10 vs NB:Karamizadeh et al. (2013);10;NA;NA;NA;excellent or good internal consistency;NA;0;NA;NA;NA;NA;NA;1;"information security awareness (intention to practice IT security); information security behavior";"awareness; security behavior";"other; behavior";0;NA;NA;230;230;NA;NA;NA;NA;NA;NA;NA;ICT department employees of universities;university staff;2;Iran
98;2;Booth et al.;2019;The Privacy Paradox in HCI: Calculus Behavior in Disclosing PII Online;Nah et al.;6th International Conference, HCI in Business, Government and Organizations 2019;NA;NA;163–177;Orlando, FL, USA;10.1007/978-3-030-22338-0_13;NA;3 (google scholar, 26.4.21);NA;0;1;NA;2;NA;0;not_specified;1;IB:11 vs NB:5;11;NA;NA;NA;NA;NA;0;NA;NA;NA;NA;NA;1;intention to disclose personal information;disclosure intention;intention;0;NA;NA;67;67;"majority 18-25 (n=64); range 18-40";22,0175000000000;2/3 (n = 47) male;70,15;29,85;NA;NA;students;students;2;USA
99;5;Booth;2019;Tipping the balance in privacy calculus: The roles of perceived trustworthiness, uncertainty, and cyber self-efficacy in an online user’s intention to disclose PII;NA;Doctor of Philosophy;NA;NA;NA;Tallahassee, FL, USA;NA;978-1392462669;0 (google scholar, 12.4.21);perceived behavioral control not included as measure for self-efficacy due to research model figure;2;1;NA;0;0;0;"not_specified; social_network";1;9;114;NA;NA;NA;NA;NA;1;cyber privacy awareness message;awareness campaign;vicarious experience;NA;0;1;intention to disclose personally identifiable information;disclosure intention;intention;1;"intervention consisting of randomly presented pairs of cyber privacy awareness messages; relied on the literature around perceived trustworthiness and
uncertainty of control (as part of privacy concern) to craft cyber privacy awareness messages
that, I submit, are reasonably calculated to either increase or decrease an individual’s level of
perceived trustworthiness, on the one hand, and to either increase or decrease their perception of
uncertainty on the other; objective of each cyber privacy awareness message was to present the participant-Online User
with scenarios drafted such that they could easily imagine that “this could be me.”; The full text of the cyber privacy awareness message corresponding to each
condition is presented in Table 2; UCOI conditions, set forth in Table 3";exposure to cyber privacy risk awareness messages: levels of perceived trustworthiness (increased vs. decreased) and levels perception of uncertainty (increased vs. decreased);201;201;"18-20: 49.74%; 21-25: 45.55%; 26-30: 3.66%; 41-45: 0.52%; 50+: 0.52%; 11 = NA";21,0158496000000;"47.64% male; 50.79% female; 1.05% chose not to identify; 0.52% nonbinary";47,64;50,79;0,52;1,05;NA;NA;1;USA
111;0;Bulgurcu et al.;2010;Information security policy compliance: An empirical study of rationality-based beliefs and information security awareness;NA;Mis Quarterly;34;3;523–548;NA;NA;NA;1980 (google scholar, 26.4.21);NA;1;1;NA;2;0;0;not_specified;1;IB:12 vs NB:6;12A;NA;NA;NA;NA;NA;0;NA;NA;NA;NA;NA;1;intention to comply with information security policies;compliance intention;intention;0;NA;NA;464;464;"20-25: 2%; 26-35: 34%; 36-45: 36%; 46-55: 20%; 56-65: 7%; 66-75: 0%; 76-85: 1%";40,5400000000000;"48% male; 52% female";48,00;52,00;NA;NA;employees;employees;0;USA
116;0;Carruth et al.;2017;Social networking and privacy attitudes among college students;NA;Psychology Society & Education;6;2;82-93;NA;10.25115/psye.v6i2.510;NA;11 (google scholar, 05.7.21);NA;1;1;NA;2;1;0;"not_specified; facebook";1;10;62;NA;NA;NA;NA;NA;0;NA;NA;NA;NA;NA;1;specific concerns about Facebook social media privacy;concerns;other;0;NA;NA;284;284;M = 25 (sd =1.799);25,0000000000000;male 68 (23.9%), female 216 (76.1%);23,90;76,10;NA;NA;students;students;2;USA
123;0;Cavus et al.;2016;The scale for the self‐efficacy and perceptions in the safe use of the Internet for teachers: The validity and reliability studies;NA;British Journal of Educational Technology;47;1;76-90;NA;10.1111/bjet.12217;NA;14 (google scholar, 8.6.21);NA;1;1;NA;2;NA;0;"not_specified; computer";1;IB:13 vs NB:;13;NA;NA;NA;NA;NA;0;NA;NA;NA;NA;NA;0;NA;NA;NA;0;NA;NA;170;170;"mean 28; range 22-59";28,0000000000000;"47.65% male; 52.35% female";47,65;52,35;NA;NA;college teachers;university staff;2;Cyprus
124;2;Cavus et al.;2017;Scale for Efficacy in the Safe Use of the Internet for Students;NA;New Trends and Issues Proceedings on Humanities and Social Sciences;NA;3;227–234;Online;10.18844/gjhss.v3i3.1557;NA;2 (google scholar, 12.4.21);"Original scale: refer to Cavus (2014), but is Cavus (2016, paper ID 123); i.e., original scale present and not recoded in Codebook 2";0;1;NA;2;NA;0;"not_specified; computer";0;IB:13 vs NB:16;13;0.72;0.72;NA;NA;NA;1;"gender; age";"gender; age";"other; other";"demographics; demographics";0;0;NA;NA;NA;0;NA;NA;99;99;"18-20: 25.25%; 21-23: 34.35%; 24-26: 21.21%; +27: 19.19%";26,0046500000000;"54.46% male; 45.45% female";54,46;45,45;NA;NA;students;students;2;Cyprus
128;0;Chen et al.;2021;E-waste information security protection motivation: the role of optimism bias;NA;Information Technology and People;NA;NA;NA;NA;10.1108/itp-09-2019-0458;NA;0 (google scholar, 05.7.21);"a: pilot sample (not included); b: study sample";1;1;B;2;0;0;smartphone;1;11;63;NA;NA;NA;NA;NA;0;NA;NA;NA;NA;NA;1;intention to protect information security in E-waste;protection intention;intention;0;NA;NA;348;348;"20 and younger: 7 (2.0%)
21–30: 170 (48.9%)
31–40: 117 (33.6%)
41–50: 32 (9.2%)
51 and older: 22 (6.3%)";32,4600000000000;male 164 (47.1%), female 184 (52.9%);47,10;52,90;NA;NA;NA;NA;0;China
129;0;Chen;2018;Revisiting the Privacy Paradox on Social Media With an Extended Privacy Calculus Model: The Effect of Privacy Concerns, Privacy Self-Efficacy, and Social Capital on Privacy Management;NA;American Behavioral Scientist;62;10;1392-1412;NA;10.1177/0002764218792691;NA;48 (google scholar, 05.7.21);Hong Kong sample (wave 1);1;1;A;2;0;0;"not_specified; social_network";1;12A;64A;NA;NA;NA;NA;NA;0;NA;NA;NA;NA;NA;1;"limiting profile visibility; self-disclosure; friending";"profile visibility; disclosure behavior; friending";"behavior; behavior; behavior";0;NA;NA;1141;1141;NA;NA;NA;NA;NA;NA;NA;NA;NA;0;Hongkong
